{
  "$schema": "https://json-schema.org/draft/2020-12/schema",
  "$id": "https://monkey-skills/investing-toolkit/data-kr/memo-fetch.json",
  "title": "data-kr memo-fetch pack (Tier 2 only — DART deferred)",
  "description": "Output of `pack.py --pack memo-fetch --ticker <KR ticker>`. Full data bundle for a Korean equity memo: yfinance `info` + 5y `history` + annual + quarterly financials. **Tier 2 only**: Korean primary-source equity (DART, dart.fss.or.kr) is not wired in this skill yet — `_provenance.primary_source_status` is always 'deferred'. Treat all financials as unverified scraper output and surface this caveat in any downstream memo.",
  "type": "object",
  "required": [
    "pack",
    "country",
    "ticker",
    "tier",
    "info",
    "financials_annual",
    "financials_quarterly",
    "price_history",
    "_provenance"
  ],
  "properties": {
    "pack": {"type": "string", "const": "memo-fetch"},
    "country": {"type": "string", "const": "kr"},
    "ticker": {"type": "string"},
    "tier": {"type": "string", "const": "Tier 2 only"},
    "info": {
      "type": "object",
      "description": "Same shape as snapshot.info — yfinance info dict.",
      "required": ["ticker"],
      "properties": {
        "ticker": {"type": "string"},
        "fetched_at": {"type": "string", "format": "date-time"},
        "_cache": {"type": "string", "enum": ["hit", "miss"]},
        "symbol": {"type": "string"},
        "marketCap": {"type": ["number", "integer", "null"]},
        "enterpriseValue": {"type": ["number", "integer", "null"]},
        "forwardPE": {"type": ["number", "null"]},
        "trailingPE": {"type": ["number", "null"]}
      },
      "additionalProperties": true
    },
    "financials_annual": {
      "type": "object",
      "description": "yfinance `financials --period annual` output (Tier 2 scraper). Keys are yfinance-driven; the canonical subset is enumerated below.",
      "properties": {
        "ticker": {"type": "string"},
        "period": {"type": "string", "const": "annual"},
        "fetched_at": {"type": "string", "format": "date-time"},
        "_cache": {"type": "string", "enum": ["hit", "miss"]},
        "latest_period": {"type": ["string", "null"]},
        "key_metrics": {"type": ["object", "null"]},
        "income_statement": {"type": ["object", "null"]},
        "balance_sheet": {"type": ["object", "null"]},
        "cash_flow": {"type": ["object", "null"]},
        "_warning": {"type": "string"},
        "_provenance": {"type": "object"}
      },
      "additionalProperties": true
    },
    "financials_quarterly": {
      "type": "object",
      "description": "yfinance `financials --period quarterly` output. Same shape as financials_annual but with `period: 'quarterly'`.",
      "properties": {
        "ticker": {"type": "string"},
        "period": {"type": "string", "const": "quarterly"},
        "fetched_at": {"type": "string", "format": "date-time"},
        "_cache": {"type": "string", "enum": ["hit", "miss"]},
        "latest_period": {"type": ["string", "null"]},
        "key_metrics": {"type": ["object", "null"]},
        "income_statement": {"type": ["object", "null"]},
        "balance_sheet": {"type": ["object", "null"]},
        "cash_flow": {"type": ["object", "null"]},
        "_warning": {"type": "string"},
        "_provenance": {"type": "object"}
      },
      "additionalProperties": true
    },
    "history": {
      "type": "array",
      "description": "T1 canonical OHLCV alias — flat list of OHLCV rows (same content as price_history.data). Top-level for analysis-technical. Cross-country symmetric with data-us per docs/normalization-contract.md.",
      "items": {
        "type": "object",
        "required": ["date", "open", "high", "low", "close", "volume"],
        "additionalProperties": true
      }
    },
    "income_statement": {
      "type": "object",
      "description": "T3 canonical income statement (Tier 2 yfinance fallback per ADR-0003). Annual depth 5, most-recent-first. Contains revenue / operating_income / ebit / net_income arrays + _meta.",
      "additionalProperties": true
    },
    "cash_flow": {
      "type": "object",
      "description": "T3 canonical cash flow (Tier 2 yfinance). operating_cash_flow / capex / fcf + _meta.",
      "additionalProperties": true
    },
    "balance_sheet": {
      "type": "object",
      "description": "T3 canonical balance sheet (Tier 2 yfinance). long_term_debt / short_term_debt / total_debt / cash + _meta.",
      "additionalProperties": true
    },
    "shares_outstanding": {
      "type": ["integer", "number", "null"],
      "description": "Absolute share count from yfinance info.sharesOutstanding."
    },
    "current_price": {
      "type": ["number", "null"],
      "description": "Latest market price from yfinance info.regularMarketPrice (KRW)."
    },
    "kr_specific": {
      "type": "object",
      "description": "KR-specific extension block per Principle 3. Notes for DART deferral, K-IFRS consolidated-basis caveat.",
      "additionalProperties": true
    },
    "price_history": {
      "type": "object",
      "description": "Raw yfinance `history --period 5y` envelope. Renamed from `history` per ADR-0002 staging-tier (Principle 1: raw never deleted).",
      "required": ["ticker", "data"],
      "properties": {
        "ticker": {"type": "string"},
        "period": {"type": "string", "const": "5y"},
        "interval": {"type": "string"},
        "fetched_at": {"type": "string", "format": "date-time"},
        "_cache": {"type": "string", "enum": ["hit", "miss"]},
        "data": {
          "type": "array",
          "items": {
            "type": "object",
            "required": ["date", "open", "high", "low", "close", "volume"],
            "properties": {
              "date": {"type": "string", "format": "date"},
              "open": {"type": ["number", "null"]},
              "high": {"type": ["number", "null"]},
              "low": {"type": ["number", "null"]},
              "close": {"type": ["number", "null"]},
              "volume": {"type": ["number", "integer", "null"]}
            },
            "additionalProperties": true
          }
        },
        "latest_close": {"type": ["number", "null"]},
        "latest_date": {"type": ["string", "null"], "format": "date"},
        "rows": {"type": "integer"},
        "_provenance": {"type": "object"}
      },
      "additionalProperties": true
    },
    "_provenance": {
      "type": "object",
      "required": ["tier", "primary_source_status", "primary_source_note"],
      "properties": {
        "tier": {"type": "string"},
        "primary_source_status": {"type": "string", "const": "deferred"},
        "primary_source_note": {
          "type": "string",
          "description": "Must mention DART (전자공시시스템, dart.fss.or.kr) and treat-as-unverified caveat."
        },
        "ticker_normalization_warnings": {
          "type": "array",
          "items": {"type": "string"}
        }
      },
      "additionalProperties": true
    }
  },
  "additionalProperties": false
}
