{
  "pack": "memo-fetch",
  "country": "kr",
  "ticker": "005930.KS",
  "tier": "Tier 2 only",
  "info": {
    "ticker": "005930.KS",
    "fetched_at": "2026-05-02T01:38:34Z",
    "_cache": "miss",
    "_warning": "yfinance is an unofficial scraper. DO NOT use for financial statements (income statement, balance sheet, cash flow). Use SEC EDGAR for financials.",
    "symbol": "005930.KS",
    "shortName": "SamsungElec",
    "longName": "Samsung Electronics Co., Ltd.",
    "sector": "Technology",
    "industry": "Consumer Electronics",
    "country": "South Korea",
    "currency": "KRW",
    "exchange": "KSC",
    "regularMarketPrice": 220500.0,
    "regularMarketPreviousClose": 226000.0,
    "marketCap": 1447927159455744,
    "enterpriseValue": 1373473230290944,
    "forwardPE": 5.4149647,
    "dividendYield": 1.03,
    "payoutRatio": 0.2526,
    "fiftyTwoWeekHigh": 230000.0,
    "fiftyTwoWeekLow": 53700.0,
    "fiftyDayAverage": 198901.0,
    "twoHundredDayAverage": 127987.75,
    "sharesOutstanding": 5764191903,
    "totalRevenue": 333605947572224,
    "grossMargins": 0.39379,
    "operatingMargins": 0.21322,
    "profitMargins": 0.13267,
    "returnOnEquity": 0.10783,
    "returnOnAssets": 0.0504,
    "totalDebt": 25239138336768,
    "totalCash": 125847113564160,
    "beta": 1.211,
    "_provenance": {
      "source": "yfinance (unofficial Yahoo Finance scraper)",
      "source_authority": "Yahoo Finance (unofficial, not endorsed)",
      "data_type": "unofficial_scraper",
      "update_cycle": "near-real-time (15 min delay)",
      "typical_lag": "15 minutes (price) / 1 day (fundamentals)",
      "fetched_at": "2026-05-02T01:38:34Z",
      "reference_period": null,
      "staleness_days": null
    }
  },
  "financials_annual": {
    "ticker": "005930.KS",
    "period": "annual",
    "fetched_at": "2026-05-02T01:38:35Z",
    "_cache": "miss",
    "latest_period": "2025-12-31",
    "key_metrics": {
      "eps": {
        "value": 6605.0,
        "source_label": "Basic EPS",
        "period": "2025-12-31"
      },
      "net_income": {
        "value": 44260956000000.0,
        "source_label": "Net Income Common Stockholders",
        "period": "2025-12-31"
      },
      "operating_income": {
        "value": 43601051000000.0,
        "source_label": "Operating Income",
        "period": "2025-12-31"
      },
      "revenue": {
        "value": 333605938000000.0,
        "source_label": "Total Revenue",
        "period": "2025-12-31"
      },
      "net_assets": {
        "value": 436320337000000.0,
        "source_label": "Total Equity Gross Minority Interest",
        "period": "2025-12-31"
      },
      "total_assets": {
        "value": 566942110000000.0,
        "source_label": "Total Assets",
        "period": "2025-12-31"
      },
      "cash_and_equivalents": {
        "value": 57856378000000.0,
        "source_label": "Cash And Cash Equivalents",
        "period": "2025-12-31"
      },
      "free_cash_flow": {
        "value": 33161999000000.0,
        "source_label": "Free Cash Flow",
        "period": "2025-12-31"
      },
      "financing_cash_flow": {
        "value": -13478040000000.0,
        "source_label": "Financing Cash Flow",
        "period": "2025-12-31"
      },
      "investing_cash_flow": {
        "value": -68512206000000.0,
        "source_label": "Investing Cash Flow",
        "period": "2025-12-31"
      },
      "operating_cash_flow": {
        "value": 85315148000000.0,
        "source_label": "Operating Cash Flow",
        "period": "2025-12-31"
      }
    },
    "income_statement": {
      "2025-12-31": {
        "Tax Effect Of Unusual Items": 30219728891.932095,
        "Tax Rate For Calcs": 0.086389,
        "Normalized EBITDA": 96664037000000.0,
        "Total Unusual Items": 349809000000.0,
        "Total Unusual Items Excluding Goodwill": 349809000000.0,
        "Net Income From Continuing Operation Net Minority Interest": 44260956000000.0,
        "Reconciled Depreciation": 46926592000000.0,
        "Reconciled Cost Of Revenue": 202235513000000.0,
        "EBITDA": 97013846000000.0,
        "EBIT": 50087254000000.0,
        "Net Interest Income": 3987311000000.0,
        "Interest Expense": 605783000000.0,
        "Interest Income": 4593094000000.0,
        "Normalized Income": 43941366728891.93,
        "Net Income From Continuing And Discontinued Operation": 44260956000000.0,
        "Total Expenses": 290004887000000.0,
        "Total Operating Income As Reported": 43601051000000.0,
        "Diluted Average Shares": 6703158564.0,
        "Basic Average Shares": 6701128842.0,
        "Diluted EPS": 6603.0,
        "Basic EPS": 6605.0,
        "Net Income Common Stockholders": 44260956000000.0,
        "Net Income": 44260956000000.0,
        "Minority Interests": -945849000000.0,
        "Net Income Including Noncontrolling Interests": 45206805000000.0,
        "Net Income Continuous Operations": 45206805000000.0,
        "Tax Provision": 4274666000000.0,
        "Pretax Income": 49481471000000.0,
        "Other Non Operating Income Expenses": 721394000000.0,
        "Special Income Charges": -153184000000.0,
        "Other Special Charges": 153184000000.0,
        "Net Non Operating Interest Income Expense": 3987311000000.0,
        "Interest Expense Non Operating": 605783000000.0,
        "Interest Income Non Operating": 4593094000000.0,
        "Operating Income": 43601051000000.0,
        "Operating Expense": 87769374000000.0,
        "Depreciation And Amortization In Income Statement": 2553265000000.0,
        "Amortization": 813976000000.0,
        "Depreciation Income Statement": 1739289000000.0,
        "Research And Development": 37740392000000.0,
        "Selling General And Administration": 37849252000000.0,
        "Selling And Marketing Expense": 30228345000000.0,
        "General And Administrative Expense": 7620907000000.0,
        "Gross Profit": 131370425000000.0,
        "Cost Of Revenue": 202235513000000.0,
        "Total Revenue": 333605938000000.0,
        "Operating Revenue": 333605938000000.0
      },
      "2024-12-31": {
        "Tax Effect Of Unusual Items": -7643351884.3752,
        "Tax Rate For Calcs": 0.082025,
        "Normalized EBITDA": 81157657000000.0,
        "Total Unusual Items": -93183000000.0,
        "Total Unusual Items Excluding Goodwill": -93183000000.0,
        "Net Income From Continuing Operation Net Minority Interest": 33621363000000.0,
        "Reconciled Depreciation": 42630822000000.0,
        "Reconciled Cost Of Revenue": 186562268000000.0,
        "EBITDA": 81064474000000.0,
        "EBIT": 38433652000000.0,
        "Net Interest Income": 3915210000000.0,
        "Interest Expense": 903918000000.0,
        "Interest Income": 4819128000000.0,
        "Normalized Income": 33706902648115.625,
        "Net Income From Continuing And Discontinued Operation": 33621363000000.0,
        "Total Expenses": 268144942000000.0,
        "Total Operating Income As Reported": 32725961000000.0,
        "Diluted Average Shares": 6792194545.0,
        "Basic Average Shares": 6792194545.0,
        "Diluted EPS": 4950.0,
        "Basic EPS": 4950.0,
        "Net Income Common Stockholders": 33621363000000.0,
        "Net Income": 33621363000000.0,
        "Minority Interests": -829988000000.0,
        "Net Income Including Noncontrolling Interests": 34451351000000.0,
        "Net Income Continuous Operations": 34451351000000.0,
        "Tax Provision": 3078383000000.0,
        "Pretax Income": 37529734000000.0,
        "Other Non Operating Income Expenses": 458747000000.0,
        "Special Income Charges": -258590000000.0,
        "Other Special Charges": 258590000000.0,
        "Net Non Operating Interest Income Expense": 3915210000000.0,
        "Interest Expense Non Operating": 903918000000.0,
        "Interest Income Non Operating": 4819128000000.0,
        "Operating Income": 32725961000000.0,
        "Operating Expense": 81582674000000.0,
        "Depreciation And Amortization In Income Statement": 2405725000000.0,
        "Amortization": 716646000000.0,
        "Depreciation Income Statement": 1689079000000.0,
        "Research And Development": 34998142000000.0,
        "Selling General And Administration": 35078235000000.0,
        "Selling And Marketing Expense": 28340823000000.0,
        "General And Administrative Expense": 6737412000000.0,
        "Gross Profit": 114308635000000.0,
        "Cost Of Revenue": 186562268000000.0,
        "Total Revenue": 300870903000000.0,
        "Operating Revenue": 300870903000000.0
      },
      "2023-12-31": {
        "Tax Effect Of Unusual Items": -22864080000.0,
        "Tax Rate For Calcs": 0.24,
        "Normalized EBITDA": 50698344000000.0,
        "Total Unusual Items": -95267000000.0,
        "Total Unusual Items Excluding Goodwill": -95267000000.0,
        "Net Income From Continuing Operation Net Minority Interest": 14473401000000.0,
        "Reconciled Depreciation": 38666559000000.0,
        "Reconciled Cost Of Revenue": 180388580000000.0,
        "EBITDA": 50603077000000.0,
        "EBIT": 11936518000000.0,
        "Net Interest Income": 3427769000000.0,
        "Interest Expense": 930253000000.0,
        "Interest Income": 4358022000000.0,
        "Normalized Income": 14545803920000.0,
        "Net Income From Continuing And Discontinued Operation": 14473401000000.0,
        "Total Expenses": 252368518000000.0,
        "Total Operating Income As Reported": 6566976000000.0,
        "Diluted Average Shares": 6791835289.0,
        "Basic Average Shares": 6791835289.0,
        "Diluted EPS": 2131.0,
        "Basic EPS": 2131.0,
        "Net Income Common Stockholders": 14473401000000.0,
        "Net Income": 14473401000000.0,
        "Minority Interests": -1013699000000.0,
        "Net Income Including Noncontrolling Interests": 15487100000000.0,
        "Net Income Continuous Operations": 15487100000000.0,
        "Tax Provision": -4480835000000.0,